{
  "schema_version": "obs.recorder_power_policy.v1",
  "policy_id": "default-battery-safe-recorder-policy",
  "modes": [
    {
      "mode": "unknown",
      "max_samples_per_second": 16,
      "max_retention_ms": 60000,
      "low_priority_signals_enabled": true,
      "data_quality": {
        "dropped": false,
        "drop_count": 0,
        "throttled": false,
        "missing": [],
        "truncated": false,
        "clock_confidence": "medium",
        "notes": [
          "unknown power mode keeps default recorder budget but does not claim battery safety"
        ]
      }
    },
    {
      "mode": "ac_power",
      "max_samples_per_second": 16,
      "max_retention_ms": 60000,
      "low_priority_signals_enabled": true,
      "data_quality": {
        "dropped": false,
        "drop_count": 0,
        "throttled": false,
        "missing": [],
        "truncated": false,
        "clock_confidence": "medium",
        "notes": []
      }
    },
    {
      "mode": "battery_normal",
      "max_samples_per_second": 4,
      "max_retention_ms": 30000,
      "low_priority_signals_enabled": true,
      "data_quality": {
        "dropped": false,
        "drop_count": 0,
        "throttled": true,
        "missing": [],
        "truncated": false,
        "clock_confidence": "medium",
        "notes": [
          "battery_normal reduces recorder sampling rate"
        ]
      }
    },
    {
      "mode": "battery_low",
      "max_samples_per_second": 1,
      "max_retention_ms": 10000,
      "low_priority_signals_enabled": false,
      "data_quality": {
        "dropped": false,
        "drop_count": 0,
        "throttled": true,
        "missing": [
          "low-priority signals may be disabled by battery_low policy"
        ],
        "truncated": false,
        "clock_confidence": "medium",
        "notes": [
          "battery_low preserves only high-priority recorder signals"
        ]
      }
    },
    {
      "mode": "battery_critical",
      "max_samples_per_second": 1,
      "max_retention_ms": 5000,
      "low_priority_signals_enabled": false,
      "data_quality": {
        "dropped": false,
        "drop_count": 0,
        "throttled": true,
        "missing": [
          "low-priority signals disabled by battery_critical policy"
        ],
        "truncated": false,
        "clock_confidence": "medium",
        "notes": [
          "battery_critical keeps minimum recorder evidence only"
        ]
      }
    }
  ],
  "data_quality": {
    "dropped": false,
    "drop_count": 0,
    "throttled": false,
    "missing": [],
    "truncated": false,
    "clock_confidence": "medium",
    "notes": []
  }
}
